{
  "schema_version": 1,
  "skill_version": "4.1.0",
  "id": "CUMCM",
  "competition": "CUMCM",
  "team_size": 3,
  "reference_duration_seconds": 259200,
  "phase_mapping": "proportional",
  "phases": [
    {"id": "CONTEST_INTAKE_AND_SELECTION", "start_seconds": 0, "end_seconds": 14400},
    {"id": "MVP_MODELING", "start_seconds": 14400, "end_seconds": 43200},
    {"id": "FORMAL_MODELING", "start_seconds": 43200, "end_seconds": 108000},
    {"id": "VALIDATION_AND_ROBUSTNESS", "start_seconds": 108000, "end_seconds": 162000},
    {"id": "PAPER_AND_VISUALIZATION", "start_seconds": 162000, "end_seconds": 216000},
    {"id": "REVIEW_AND_REVISION", "start_seconds": 216000, "end_seconds": 244800},
    {"id": "SUBMISSION_FREEZE", "start_seconds": 244800, "end_seconds": 259200}
  ],
  "control_thresholds": {
    "finalization_seconds": 21600,
    "hard_freeze_seconds": 7200
  },
  "safety_margins": {
    "NORMAL": {"minimum_seconds": 900, "eta_multiplier": 0.1},
    "FINALIZATION_MODE": {"minimum_seconds": 1800, "eta_multiplier": 0.5},
    "HARD_FREEZE": {"minimum_seconds": 3600, "eta_multiplier": 1.0}
  },
  "node_policies": {
    "contest_intake": {"phase_affinity": ["CONTEST_INTAKE_AND_SELECTION"], "decision_relevance": "HIGH", "scientific_risk": "LOW", "submission_critical": false, "high_risk_change": false, "job_required": false},
    "problem_decomposition": {"phase_affinity": ["CONTEST_INTAKE_AND_SELECTION"], "decision_relevance": "HIGH", "scientific_risk": "LOW", "submission_critical": false, "high_risk_change": false, "job_required": false},
    "problem_selection": {"phase_affinity": ["CONTEST_INTAKE_AND_SELECTION"], "decision_relevance": "HIGH", "scientific_risk": "MEDIUM", "submission_critical": false, "high_risk_change": true, "job_required": false},
    "assumptions": {"phase_affinity": ["CONTEST_INTAKE_AND_SELECTION", "MVP_MODELING"], "decision_relevance": "HIGH", "scientific_risk": "MEDIUM", "submission_critical": false, "high_risk_change": false, "job_required": false},
    "method_candidates": {"phase_affinity": ["MVP_MODELING"], "decision_relevance": "HIGH", "scientific_risk": "HIGH", "submission_critical": false, "high_risk_change": true, "job_required": false},
    "minimal_viable_model": {"phase_affinity": ["MVP_MODELING"], "decision_relevance": "HIGH", "expected_information_gain": "HIGH", "scoring_risk": "HIGH", "scientific_risk": "MEDIUM", "submission_critical": false, "high_risk_change": false, "job_required": true},
    "pilot_solve": {"phase_affinity": ["MVP_MODELING"], "decision_relevance": "HIGH", "scientific_risk": "MEDIUM", "submission_critical": false, "high_risk_change": false, "job_required": true},
    "model_validation": {"phase_affinity": ["MVP_MODELING", "VALIDATION_AND_ROBUSTNESS"], "decision_relevance": "HIGH", "scientific_risk": "LOW", "submission_critical": true, "high_risk_change": false, "job_required": true},
    "formal_solve": {"phase_affinity": ["FORMAL_MODELING"], "decision_relevance": "HIGH", "scientific_risk": "MEDIUM", "submission_critical": false, "high_risk_change": false, "job_required": true},
    "sensitivity_robustness": {"phase_affinity": ["VALIDATION_AND_ROBUSTNESS"], "decision_relevance": "HIGH", "scientific_risk": "LOW", "submission_critical": true, "high_risk_change": false, "job_required": true},
    "model_improvement": {"phase_affinity": ["FORMAL_MODELING", "VALIDATION_AND_ROBUSTNESS"], "decision_relevance": "MEDIUM", "scientific_risk": "HIGH", "submission_critical": false, "high_risk_change": true, "job_required": true},
    "visualization": {"phase_affinity": ["PAPER_AND_VISUALIZATION", "REVIEW_AND_REVISION"], "decision_relevance": "MEDIUM", "scientific_risk": "LOW", "submission_critical": true, "high_risk_change": false, "job_required": false},
    "paper_draft": {"phase_affinity": ["FORMAL_MODELING", "PAPER_AND_VISUALIZATION"], "decision_relevance": "HIGH", "expected_information_gain": "MEDIUM", "scoring_risk": "HIGH", "scientific_risk": "LOW", "submission_critical": true, "high_risk_change": false, "job_required": false},
    "competition_review": {"phase_affinity": ["REVIEW_AND_REVISION"], "decision_relevance": "HIGH", "scientific_risk": "LOW", "submission_critical": true, "high_risk_change": false, "job_required": false},
    "revision": {"phase_affinity": ["REVIEW_AND_REVISION", "SUBMISSION_FREEZE"], "decision_relevance": "HIGH", "scientific_risk": "LOW", "submission_critical": true, "high_risk_change": false, "job_required": false},
    "submission_preflight": {"phase_affinity": ["SUBMISSION_FREEZE"], "decision_relevance": "HIGH", "scientific_risk": "LOW", "submission_critical": true, "high_risk_change": false, "job_required": false}
  }
}
